 郭秀珠 ,官田區大崎里莿仔埔往大井農路改善工程, 官田區 ,"1,920 ",642 ,農業工程及農路改善, 農業局 , 公開招標 ,弘鋅土木包工業,,14
 蔡育輝 ,柳營區北桶頭支線改善工程, 柳營區 ,"1,300 ",341 ,農業工程及農路改善, 農業局 , 公開取得 ,玖郁土木包工業,,14
 賴惠員 ,東山區高原里竹頭排野溪改善工程, 東山區 ,"1,857 ",980 ,水利工程, 水利局 , 公開招標 ,益成土木包工業,,14
 杜素吟 ,103年度仁德區雨水及排水改善工程, 仁德區 ,"6,600 ","6,600 ",水利工程, 水利局 , 公開招標 ,泰鈞營造有限公司,,14
 王峻潭 ,玉井區中正里(斗六高分28左3左2)排水改善工程, 玉井區 ,600 ,580 ,水利工程, 水利局 , 公開招標 ,明進土木包工業,,14
 張伯祿 ,龍崎區土崎里觀音山慈聖宮後方排水改善工程, 龍崎區 ,700 ,500 ,水利工程, 水利局 , 辦理發包中 ,,,14
 張伯祿 ,龍崎區楠坑里變電所西北側排水溝擋土改善工程, 龍崎區 ,400 ,500 ,水利工程, 水利局 , 辦理發包中 ,,,14
 蔡育輝 ,白河區仙草里險潭三號橋旁野溪護岸崩塌改善工程, 白河區 ,690 ,630 ,水利工程, 水利局 , 辦理發包中 ,,,14
 賴美惠 ,後壁區新東里下茄苳大排(台鐵下游處)護岸改善工程, 後壁區 ,"4,000 ","4,000 ",水利工程, 水利局 , 公開招標 ,瓏泰土木包工業,,14
 賴美惠 ,東山區科里里科里排水分流改善工程, 東山區 ,"3,653 ","3,653 ",水利工程, 水利局 , 公開招標 ,瓏泰土木包工業,,14
 郭信良 ,本原街三段234巷106弄28號轉角處路燈增設工程, 安南區  ,12 ,12 ,工程建築及設備, 工務局 , 開口契約 ,立業實業社,,14
 郭信良 ,本田路三段691號路燈遷移工程, 安南區  ,12 ,12 ,工程建築及設備, 工務局 , 開口契約 ,立業實業社,,14
 李文正 ,運河、228等公園設置告示牌及版面更新, 安平區   ,64 ,64 ,工程建築及設備, 工務局 , 逕洽廠商 ,福田工程行,,14
 李文俊 ,善化區湖厝里南128-1線與嘉南大圳南幹支線版橋拓寬改善工程, 善化區 ,499 ,499 ,工程建築及設備, 工務局 , 公開取得 ,佳霖土木包工業,,14
 王峻潭 ,南化區玉山里道路路燈新設工程, 南化區 ,120 ,120 ,工程建築及設備, 工務局 , 公開招標 ,永大水電行,,14
 賴惠員 ,後壁區長短樹段里內道路破損嚴重申請提供美瀝包, 後壁區 ,4 ,4 ,工程建築及設備, 工務局 , 公開招標 ,郁豐營造有限公司,,14
 郭清華 ,青砂街一段572巷149號旁路燈增設, 安南區 ,8 ,8 ,工程建築及設備, 工務局 , 開口契約 ,立業實業社,,14
"陸美祈
 陳文賢",六甲區中社里中社社區等路面改善工程, 六甲區 ,784 ,784 ,工程建築及設備, 工務局 , 公開招標 ,宏泰吉營造有限公司,,14
 洪玉鳳 ,仁德區仁和里保華路(成功一街至二空路)及二空路部分路段路面刨鋪案, 仁德區 ,770 ,770 ,工程建築及設備, 工務局 , 公開招標 ,"皇瑄股份有限公司
雲嘉南實業有限公司",,14
 陳文賢 ,下營區仁里里仁南街6巷、後街里大愛街、新興里寮前一街等路面改善, 下營區 ,600 ,600 ,工程建築及設備, 工務局 , 公開招標 ,"皇瑄股份有限公司
雲嘉南實業有限公司",,14
 陳朝來 ,七股區頂山里入口意象工程, 七股區 ,"1,400 ","1,400 ",工程建築及設備, 工務局 , 公開招標  ,和晟營造有限公司 ,,14
 林宜瑾 ,永康區復興路423巷路面及擋土牆改善工程, 永康區 ,900 ,900 ,工程建築及設備, 工務局 , 公開取得 ,禹宏土木包工業,,14
 謝財旺 ,將軍區嘉昌里道路改善工程, 將軍區 ,417 ,417 ,工程建築及設備, 工務局 , 公開取得 ,金昌土木包工業 ,,14
 郭秀珠 ,下營區開化里南61線路燈改善工程, 下營區  ,182 ,182 ,工程建築及設備, 工務局 , 公開招標 ,南億水電工程有限公司,,14
 陸美祈 ,東區崇德里崇德七街道路路面改善, 東區 ,270 ,270 ,工程建築及設備, 工務局 , 公開招標 ,"雲嘉南實業有限公司
皇瑄股份有限公司
永豐砂石行
浩光企業社",,14
 郭清華 ,安南區安通路五段北側車道路面修復及鹿耳門聖母廟東側停車場聯外車道舖築AC刨除料, 安南區 ,593 ,593 ,工程建築及設備, 工務局 , 公開招標 ,"雲嘉南實業有限公司
皇瑄股份有限公司
永豐砂石行
浩光企業社",,14
 郭清華 ,七股區南39線十份橋附近道路，逢下雨致大面積積水, 七股區 ,510 ,510 ,工程建築及設備, 工務局 , 公開招標 ,"雲嘉南實業有限公司
皇瑄股份有限公司
永豐砂石行
浩光企業社",,14
 蔡育輝 ,鹽水區舊營里庄內路路面改善工程等4件工程, 鹽水區 ,"1,479 ","1,479 ",工程建築及設備, 工務局 , 開口契約 ,堆高營造有限公司,,14
 頼惠員 ,新營區鐵線里里內道路破損提供美瀝包, 新營區 ,7 ,7 ,工程業務管理, 工務局 , 公開招標 ,郁豐營造有限公司,,14
 王錦德 ,工明南一路及工明三路增設路燈, 安南區 ,20 ,20 ,工程建築及設備, 工務局 , 開口契約 ,立業實業社,,14
 林炳利 ,安南區安豐四街111號至158號巷道路面改善, 安南區 ,160 ,160 ,工程建築及設備, 工務局 , 公開招標 ,"雲嘉南實業有限公司
皇瑄股份有限公司
永豐砂石行
浩光企業社",,14
 林美燕 ,南區塩埕天后宮鋪設簡易瀝青, 南區 ,25 ,25 ,工程建築及設備, 工務局 , 公開招標 ,"雲嘉南實業有限公司
皇瑄股份有限公司
永豐砂石行
浩光企業社",,14
 謝財旺 ,三寮灣地區道路路面改善工程, 北門區 ,659 ,450 ,建築及設備, 民政局 , 公開取得 ,弘鋅營造有限公司,,14
 王峻潭 ,新化區礁坑里武廟前道路改善工程, 新化區 ,735 ,630 ,建築及設備, 民政局 , 公開招標 ,宇成土木包工業,,14
 曾順良 ,泉南里活動中心汰換冷氣設備, 東區 ,322 ,322 ,建築及設備, 民政局 , 公開取得 ,大同綜合視電股份有限公司,,14
 林志聰 ,山上區明南段144地號設置休憩平台及休閒設施工程, 山上區 ,400 ,400 ,建築及設備, 民政局 , 公開取得 ,和晟營造有限公司,,14
 陳文科 ,東區崇文崇成里聯合活動中心增社內部設備, 東區 ,140 ,140 ,建築及設備, 民政局 , 逕洽廠商 ,"凱繹國際有限公司
富誰營造有限公司
華慶水電工程行",,14
 張伯祿 ,滑輪溜冰曲棍球場整建工程(工程款), 關廟區 ,"1,450 ","1,450 ",營建及修建工程, 教育局 , 公開招標 ,鴻銘土木包工業,,14
 侯澄財 ,玉港地區漁塭養殖區產業道路路面改善工程, 北門區 ,441 ,420 ,漁業建設, 農業局 , 公開招標 ,弘鋅營造有限公司,,15
 李退之 ,新營區農地重劃工程第三工區H-1農路 柏油路面改善工程, 新營區 ,590 ,502 ,農業工程及農路改善, 農業局 , 公開招標 ,昆城土木包工業,,15
 郭秀珠 ,官田區大崎里南藝大旁農路改善工程, 官田區 ,780 ,683 ,農業工程及農路改善, 農業局 , 公開招標 ,弘鋅土木包工業,,15
 蔡秋蘭 ,三股里（九股仔）漁產道路改善工程, 七股區 ,596 ,210 ,漁業建設, 農業局 , 公開招標 ,弘鋅營造有限公司,,15
 李文俊 ,103-密枝雙溪農路改善工程, 楠西區 ,141 ,165 ,農業工程及農路改善, 農業局 , 公開取得 ,佑吉營造有限公司,,15
 張世賢 ,後壁區崁頂里3鄰通往明善營公產業農路改善工程, 後壁區 ,235 ,235 ,農業工程及農路改善, 農業局 , 公開取得 ,承瑋營造有限公司,,15
 黃麗招 ,103-照興口山頂農路改善工程, 楠西區 ,198 ,126 ,農業工程及農路改善, 農業局 , 公開取得 ,佑吉營造有限公司,,15
 侯澄財 ,慈安地區漁塭路面舖設刨除料改善工程, 北門區 ,200 ,184 ,漁業建設, 農業局 , 公開招標 ,世全土木包工業,,15
 陳文賢 ,麻豆區港尾里客子寮(瓦寮高幹70旁)農路改善工程, 麻豆區 ,386 ,300 ,農業工程及農路改善, 農業局 , 辦理發包中 ,,,15
 郭信良 ,安南區四草里大眾路301巷內漁產道路改善工程, 安南區 ,69 ,70 ,漁業建設, 農業局 , 逕洽廠商 ,峻豪土木包工業,,15
 王定宇 ,關廟區山西里成功路尾排水改善工程, 關廟區 ,"1,050 ","1,000 ",水利工程, 水利局 , 公開招標 ,承立營造有限公司,,15
 杜素吟 ,仁德工業區排水設施改善工程, 仁德區 ,"2,000 ","2,000 ",水利工程, 水利局 , 公開招標 ,穎昌工程企業有限公司,,15
 王峻潭 ,玉井區望明里貓兒干野溪延續整治工程, 玉井區 ,788 ,400 ,水利工程, 水利局 , 公開招標 ,得意土木包工業,,15
 張伯祿 ,關廟區新光里照鏡排水改善工程, 關廟區 ,604 ,500 ,水利工程, 水利局 , 辦理發包中 ,,,15
 張伯祿 ,龍崎區崎頂里崎腳排水改善工程, 龍崎區 ,600 ,480 ,水利工程, 水利局 , 辦理發包中 ,,,15
 賴美惠 ,白河區大林里六重溪慈善橋上游左側護岸興建工程, 白河區 ,"1,750 ","1,400 ",水利工程, 水利局 , 辦理發包中 ,,,15
"賴美惠
 張世賢",白河區崎內里5鄰洪永源農地旁排水改善工程, 白河區 ,"1,000 ","1,000 ",水利工程, 水利局 , 公開招標 ,玖郁土木包工業,,15
 賴美惠 ,東山區三榮里木柵排水(忠義公旁)排水改善工程, 東山區 ,"1,800 ","1,800 ",水利工程, 水利局 , 公開招標 ,瓏泰土木包工業,,15
 郭信良 ,安中路四段154巷57弄14號前路燈增設工程, 安南區  ,18 ,18 ,工程建築及設備, 工務局 , 開口契約 ,立業實業社,,15
 郭信良 ,本田街三段234巷106弄口路燈增設工程, 安南區  ,15 ,15 ,工程建築及設備, 工務局 , 開口契約 ,立業實業社,,15
 蔡秋蘭 ,西港區西港里社區道路改善工程, 西港區  ,"1,968 ","1,968 ",工程建築及設備, 工務局 , 公開招標 ,"皇瑄股份有限公司
雲嘉南實業有限公司",,15
 賴美惠 ,東山區南勢里崁頭山(嘉湖高分32)道路改善工程, 東山區 ,600 ,600 ,工程建築及設備, 工務局 , 公開取得 ,奕昌土木包工業,,15
 林全忠 ,山上區北勢洲山上堤防鈉光燈增設工程, 山上區 ,200 ,200 ,工程建築及設備, 工務局 , 公開招標 ,騏明實業有限公司,,15
 盧崑福 ,辦理慶平公園.公兒17等整修工程綠地現況測量, 安平區 ,40 ,40 ,工程建築及設備, 工務局 , 逕洽廠商 ,三佳測量工程顧問有限公司,,15
 謝龍介 ,開南街275巷路面損壞嚴重, 北區 ,774 ,774 ,工程建築及設備, 工務局 , 公開招標 ,"皇瑄股份有限公司
雲嘉南實業有限公司",,15
 楊麗玉 ,麻豆區巷口里興國路31巷道路路面改善工程, 麻豆區 ,172 ,258 ,工程建築及設備, 工務局 , 公開招標 ,宏泰吉營造有限公司,,15
 侯澄財 ,將軍區忠興里道路改善工程、鯤溟里路面改善工程, 將軍區 ,710 ,710 ,工程建築及設備, 工務局 , 公開招標 ,"皇瑄股份有限公司
雲嘉南實業有限公司",,15
 施重男 ,永康區施重男議員申請美瀝泡供自行修補道路, 永康區 ,2 ,2 ,工程建築及設備, 工務局 , 公開招標 ,"皇瑄股份有限公司
雲嘉南實業有限公司",,15
 賴惠員 ,鹽水區水秀里土庫56-3號前排水溝興建工程, 鹽水區 ,334 ,334 ,工程建築及設備, 工務局 , 公開招標 ,坤茂營造有限公司,,15
 林燕祝 ,永康區中山南路490巷14弄及57弄道路改善工程, 永康區 ,435 ,435 ,工程建築及設備, 工務局 , 公開取得 ,玉雨土木包工業 ,,15
 謝財旺 ,學甲區新達里中學路32巷路面改善工程, 學甲區 ,214 ,214 ,工程建築及設備, 工務局 , 公開招標 ,弘鋅營造有限公司 ,,15
 賴美惠 ,白河區內角里日光燈更換鈉氣燈及照明設施工程, 白河區 ,175 ,175 ,工程建築及設備, 工務局 , 公開招標 ,永大水電行,,15
 李文正 ,安平區建平7街(建平7街818巷口至平豐路)路面改善, 安平區 ,482 ,482 ,工程建築及設備, 工務局 , 公開招標 ,"雲嘉南實業有限公司
皇瑄股份有限公司
永豐砂石行
浩光企業社",,15
 林慶鎮 ,新市區民生路(區道南134)道路嚴重破損刨除重鋪, 新市區 ,"2,400 ","2,400 ",工程建築及設備, 工務局 , 公開招標 ,"雲嘉南實業有限公司
皇瑄股份有限公司
永豐砂石行
浩光企業社",,15
 郭秀珠 ,郭議員申請美瀝包300包供麻豆、官田地區自行鋪設, 麻豆區 ,42 ,42 ,工程業務管理, 工務局 , 公開招標 ,郁豐營造有限公司,,15
 張世賢 ,張世賢議員申請美瀝包1000包供白河區各里自行修補道路, 白河區 ,84 ,84 ,工程業務管理, 工務局 , 公開招標 ,郁豐營造有限公司,,15
 曾順良 ,立德一路與立德八路口既有燈桿加掛燈組補強照明, 東區 ,11 ,11 ,工程建築及設備, 工務局 , 開口契約 ,立業實業社,,15
 郭信良 ,城北路736巷63之8號遷移路燈, 安南區 ,18 ,18 ,工程建築及設備, 工務局 , 開口契約 ,立業實業社,,15
 陳朝來 ,七股區篤加里庄內巷道改善工程, 七股區 ,"2,400 ","2,400 ",工程建築及設備, 工務局 , 公開招標 ,"雲嘉南實業有限公司
皇瑄股份有限公司
永豐砂石行
浩光企業社",,15
 林炳利 ,洲南公園增設石椅, 安南區 ,42 ,42 ,工程建築及設備, 工務局 , 逕洽廠商 ,天成營造有限公司,,15
 謝財旺 ,秀昌里集和宮巷道改善工程, 學甲區 ,480 ,300 ,建築及設備, 民政局 , 公開取得 ,弘鋅營造有限公司,,15
 張伯祿 ,關廟區關廟里山西宮後方綠美化及路面及排水改善工程, 關廟區 ,"1,520 ",950 ,建築及設備, 民政局 , 公開招標 ,勝崴土木包工業,,15
 張世賢 ,青山里第9鄰道路改善工程, 東山區 ,166 ,166 ,建築及設備, 民政局 , 公開取得 ,強維營造有限公司,,15
 杜素吟 ,關廟區布袋里長文街326巷路面排水改善工程, 關廟區 ,450 ,450 ,建築及設備, 民政局 , 已註銷 ,,,15
 王錦德 ,安南區長溪路一段406巷51弄及55弄路面改善, 安南區 ,310 ,310 ,建築及設備, 民政局 , 公開取得 ,峻豪土木包工業,,15
 議會教育小組 ,校舍整修工程, 將軍區 ,"2,860 ","2,860 ",營建及修建工程, 教育局 , 公開招標 ,詠淳營造有限公司,,15
 侯澄財 ,北門區雙春養殖漁業生產區產業道路改善工程, 北門區 ,417 ,278 ,漁業建設, 農業局 , 公開招標 ,弘鋅營造有限公司,,16
 杜素吟 ,土崎里凹窯惠津農路改善工程, 龍崎區 ,300 ,540 ,農業工程及農路改善, 農業局 , 公開招標 ,聯宏土木包工業,,16
 郭秀珠 ,官田區渡頭里三塊厝日新營區前產業道路改善工程, 官田區 ,"1,750 ","1,050 ",農業工程及農路改善, 農業局 , 公開招標 ,日新土木包工業,,16
 謝財旺 ,白米社區主要漁產道路改善工程, 北門區 ,378 ,315 ,漁業建設, 農業局 , 公開招標 ,弘鋅營造有限公司,,16
 李坤煌 ,南化區北寮里南寮往西平坑聯絡農路崩塌改善工程, 南化區 ,340 ,254 ,農業工程及農路改善, 農業局 , 公開招標 ,上展土木包工業,,16
 張伯祿 ,關廟區五甲里五甲尾農路改善工程, 關廟區 ,203 ,180 ,農業工程及農路改善, 農業局 , 公開招標 ,凌陽營造有限公司 ,,16
 黃麗招 ,南化區南化里北頭仔往聖天宮農路改善工程, 南化區 ,811 ,453 ,農業工程及農路改善, 農業局 , 公開招標 ,允泰土木包工業,,16
 郭清華 ,安南區鹽田里安明路二段濱海橋旁漁用產業道路改善工程, 安南區 ,462 ,302 ,漁業建設, 農業局 , 公開招標 ,騰泰土木包工業,,16
 陳文賢 ,官田區二鎮里廳太產業道路改善工程, 官田區 ,256 ,205 ,農業工程及農路改善, 農業局 , 公開招標 ,聯豐土木包工業,,16
 王錦德 ,十份里黑琵保護中心前產業道路改善工程(熱料), 七股區 ,"2,175 ",99 ,漁業建設, 農業局 , 逕洽廠商 ,翔安土木包工業,,16
 王定宇 ,臺南市關廟區深坑洲尾排水改善工程, 關廟區 ,980 ,800 ,水利工程, 水利局 , 公開招標 ,承立營造有限公司,,16
 賴美惠 ,南化區後壁籠排水改善工程, 南化區 ,"1,726 ",400 ,水利工程, 水利局 , 公開招標 ,冠頂土木包工業,,16
 王峻潭 ,玉井區望明里松腳高分32右6旁農路排水改善工程, 玉井區 ,696 ,200 ,水利工程, 水利局 , 公開招標 ,得意土木包工業,,16
 郭清華 ,龍崎區崎頂里石梯慧敏排水改善工程, 龍崎區 ,"5,000 ","3,140 ",水利工程, 水利局 , 辦理發包中 ,,,16
 張伯祿 ,龍崎區崎頂里文惠排水改善工程, 龍崎區 ,600 ,320 ,水利工程, 水利局 , 辦理發包中 ,,,16
 賴美惠 ,白河區六溪里六重溪嘉宏橋上游右側護岸新建工程, 白河區 ,"1,500 ",690 ,水利工程, 水利局 , 辦理發包中 ,,,16
 謝財旺 ,北門區頭港排水鄰近南鯤鯓抽水站段之右岸護岸新建工程, 北門區 ,"3,500 ","3,500 ",水利工程, 水利局 , 公開招標 ,集揚營造有限公司,,16
 賴美惠 ,後壁區新東里下茄苳大排防汛道路改善工程, 後壁區 ,"2,000 ","2,000 ",水利工程, 水利局 , 公開招標 ,瓏泰土木包工業,,16
 郭信良 ,安中路六段507巷16號前路燈增設工程, 安南區  ,18 ,18 ,工程建築及設備, 工務局 , 開口契約 ,立業實業社,,16
 郭信良 ,台江大道五段500號路燈增設工程, 安南區  ,12 ,12 ,工程建築及設備, 工務局 , 開口契約 ,立業實業社,,16
 林美燕 ,南區省躬里省躬三街口起約60公尺路面協助供料改善, 南區 ,165 ,165 ,工程建築及設備, 工務局 , 公開招標 ,"皇瑄股份有限公司
雲嘉南實業有限公司",,16
 賴美惠 ,東山區南勢里會社至大洋道路排水改善工程, 東山區 ,"1,500 ","1,500 ",工程建築及設備, 工務局 , 公開招標  ,益成土木包工業 ,,16
 郭國文 ,永康區正強街111號等路燈增設工程, 永康區 ,268 ,268 ,工程建築及設備, 工務局 , 公開招標 ,駿宏水電工程有限公司,,16
 洪玉鳳 ,西門路與民權路口增設路燈, 後壁區 ,30 ,30 ,工程建築及設備, 工務局 , 開口契約 ,立業實業社,,16
 林美燕 ,南都里公園遊樂設施設置遮陽鋼架網, 南區 ,97 ,97 ,工程建築及設備, 工務局 , 逕洽廠商 ,福田工程行,,16
 蔡蘇秋金 ,西港區劉厝里道路改善工程, 西港區 ,921 ,921 ,工程建築及設備, 工務局 , 公開招標 ,"皇瑄股份有限公司
雲嘉南實業有限公司",,16
 林燕祝 ,新市區永就里39-11號社區道路(番仔寮段26號)路面改善, 新市區 ,552 ,552 ,工程建築及設備, 工務局 , 公開招標 ,"皇瑄股份有限公司
雲嘉南實業有限公司",,16
 侯澄財 ,北門區慈安地區漁塭路面舖設刨除料改善工程, 北門區 ,92 ,92 ,工程建築及設備, 工務局 , 公開招標 ,"皇瑄股份有限公司
雲嘉南實業有限公司",,16
 賴美惠 ,後壁區後壁里12鄰195-30號宅旁路面及側溝改善工程, 後壁區 ,560 ,560 ,工程建築及設備, 工務局 , 公開取得 ,億興土木包工業 ,,16
 施重男 ,永康區中灣一街等道路排水改善工程, 永康區 ,780 ,780 ,工程建築及設備, 工務局 , 公開取得 ,玉雨土木包工業 ,,16
 謝財旺 ,學甲區新達里山寮村里道路路面改善工程, 學甲區 ,270 ,270 ,工程建築及設備, 工務局 , 公開招標 ,弘鋅營造有限公司 ,,16
 賴美惠 ,竹門里南90線景觀燈增設及日光燈更換鈉氣燈改善工程, 白河區 ,188 ,188 ,工程建築及設備, 工務局 , 公開招標 ,永大水電行,,16
 郭信良 ,安南區學東里公學路七段97巷路面重新翻修, 安南區 ,286 ,286 ,工程建築及設備, 工務局 , 公開招標 ,"雲嘉南實業有限公司
皇瑄股份有限公司
永豐砂石行
浩光企業社",,16
 杜素吟 ,龍崎區大平里165線區道(大坪路口)AC路面修復, 龍崎區 ,116 ,116 ,工程建築及設備, 工務局 , 公開招標 ,"雲嘉南實業有限公司
皇瑄股份有限公司
永豐砂石行
浩光企業社",,16
 黃麗招 ,安南區長安里長溪路三段380巷、長溪路三段373巷21弄尾路面改善, 安南區 ,"1,120 ","1,120 ",工程建築及設備, 工務局 , 公開招標 ,"雲嘉南實業有限公司
皇瑄股份有限公司
永豐砂石行
浩光企業社",,16
 黃麗招 ,安南區公親里公學路一段路面改善, 安南區 ,552 ,552 ,工程建築及設備, 工務局 , 公開招標 ,"雲嘉南實業有限公司
皇瑄股份有限公司
永豐砂石行
浩光企業社",,16
 莊玉珠 ,金華路一段484巷99弄口既有燈桿加掛燈組補強照明, 南區 ,11 ,11 ,工程建築及設備, 工務局 , 開口契約 ,立業實業社,,16
 賴美惠 ,後壁區長安里中寮146之30至242號宅前路面改善工程, 後壁區 ,370 ,370 ,工程建築及設備, 工務局 , 公開取得 ,大旺營造有限公司 ,,16
 陳朝來 ,七股區龍山里漁產道路改善工程, 七股區 ,61 ,61 ,工程建築及設備, 工務局 , 公開招標 ,"雲嘉南實業有限公司
皇瑄股份有限公司
永豐砂石行
浩光企業社",,16
 莊玉珠 ,開南社區公園設施設置遮陽鋼架網, 南區 ,98 ,98 ,工程建築及設備, 工務局 , 逕洽廠商 ,昇霖土木包工業,,16
 郭秀珠 ,安西里活動中心廣場地面修繕, 麻豆區 ,650 ,600 ,建築及設備, 民政局 , 公開取得 ,聯豐土木包工業,,16
 林慶鎮 ,新市區社內里社內清水宮前人民廣場改善工程, 新市區 ,"1,150 ",900 ,建築及設備, 民政局 , 公開取得 ,聯豐土木包工業,,16
 賴美惠 ,東原里社區活動中心排水溝暨無障礙設施工程, 東山區 ,237 ,237 ,建築及設備, 民政局 , 公開取得 ,奕昌土木包工業,,16
"黃麗招
 林燕祝",103-楠西區灣丘里內埔仔村里聯外道路改善工程, 楠西區 ,850 ,850 ,建築及設備, 民政局 , 公開取得 ,建欣土木包工業,,16
 郭秀珠 ,官田區南廍里增設擴音設備, 官田區 ,50 ,50 ,建築及設備, 民政局 , 逕洽廠商 ,暢泓科技顧問企業社,,16
 議會教育小組 ,教學及辦公環境設施, 柳營區 ,350 ,350 ,營建及修建工程, 教育局 , 公開招標 ,永原科學儀器有限公司,,16
 李退之 ,中樞地區漁塭產業道路路面改善工程, 北門區 ,"1,050 ",452 ,漁業建設, 農業局 , 公開招標 ,弘鋅營造有限公司,,17
 林全忠 ,大內區二溪里大埔奇瓦高幹左36農路改善工程, 大內區 ,380 ,320 ,農業工程及農路改善, 農業局 , 公開招標 ,永大土木包工業,,17
 郭信良 ,102－風窗至關帝廳農路改善工程, 楠西區 ,638 ,756 ,農業工程及農路改善, 農業局 , 公開取得 ,佑吉營造有限公司,,17
 郭信良 ,安南區大安里安通路五段230巷旁漁用道路改善工程, 安南區 ,181 ,141 ,漁業建設, 農業局 , 公開招標 ,吉田土木包工業,,17
 李退之 ,東山區東原里班芝花坑農路改善工程, 東山區 ,"1,040 ",480 ,農業工程及農路改善, 農業局 , 公開取得 ,茂盛土木包工業,,17
 張伯祿 ,關廟區五甲里五甲段3923地號旁農路排水改善工程, 關廟區 ,750 ,416 ,農業工程及農路改善, 農業局 , 公開招標 ,凌陽營造有限公司 ,,17
 黃麗招 ,安南區公學路二段123巷往公學路一段農路改善工程, 安南區 ,"1,600 ","1,239 ",農業工程及農路改善, 農業局 , 公開招標 ,承瑋營造有限公司,,17
 陳朝來 ,十份里唐明殿前往西邊漁產道路改善工程, 七股區 ,684 ,126 ,漁業建設, 農業局 , 公開招標 ,弘鋅營造有限公司,,17
 楊麗玉 ,官田區南廍里產業道路改善工程, 官田區 ,206 ,165 ,農業工程及農路改善, 農業局 , 公開招標 ,聯豐土木包工業,,17
 侯澄財 ,北門區保安漁塭養殖區路面擋土牆改善工程, 北門區 ,480 ,285 ,漁業建設, 農業局 , 公開招標 ,世全土木包工業,,17
 王峻潭 ,玉井區中正里(舊社高枝17右4)野溪護岸改善工程, 玉井區 ,"1,600 ","1,000 ",水利工程, 水利局 , 公開招標 ,協順土木包工業 ,,17
 曾王雅雲 ,龍崎區楠坑里樹子林野溝改善工程, 龍崎區 ,870 ,810 ,水利工程, 水利局 , 公開招標 ,佳泰土木包工業,,17
 王峻潭 ,楠西區興南王萊宅野溪整治工程, 楠西區 ,"1,200 ",600 ,水利工程, 水利局 , 公開招標 ,長青土木包工業,,17
 張世賢 ,白河區崎內里馬稠後段22-5旁野溪改善工程, 白河區 ,560 ,560 ,水利工程, 水利局 , 辦理發包中 ,,,17
 林全忠 ,大內區環湖里金斗湖排水改善工程, 大內區 ,"2,115 ","1,640 ",水利工程, 水利局 , 辦理發包中 ,,,17
 吳通龍 ,官田區官田小排上游支流改善工程, 官田區 ,"1,600 ","1,600 ",水利工程, 水利局 , 公開招標 ,民昌營造有限公司,,17
 謝財旺 ,學甲區宅港里舊河道護岸改善工程, 學甲區 ,"1,500 ","1,500 ",水利工程, 水利局 , 公開招標 ,鴻福土木包工業,,17
 賴美惠 ,後壁區後壁中排改善工程, 後壁區 ,"2,000 ","2,000 ",水利工程, 水利局 , 公開招標 ,顏格土木包工業,,17
 郭信良 ,培安路299巷路燈遷移工程, 安南區  ,10 ,10 ,工程建築及設備, 工務局 , 開口契約 ,立業實業社,,17
 郭信良 ,媽祖宮一街2巷2號之1路燈增設工程, 安南區  ,15 ,15 ,工程建築及設備, 工務局 , 開口契約 ,立業實業社,,17
 陳進益 ,南區永興三街34號旁空地(桶盤淺段398地號)協助供料, 南區 ,60 ,60 ,工程建築及設備, 工務局 , 公開招標 ,"皇瑄股份有限公司
雲嘉南實業有限公司",,17
 林全忠 ,大內區頭社竹宅子13鄰邊坡改善工程, 大內區 ,400 ,400 ,工程建築及設備, 工務局 , 公開招標  ,永大土木包工業 ,,17
 王定宇 ,臺南市歸仁區看東崙頂等里路燈增設工程, 歸仁區 ,117 ,117 ,工程建築及設備, 工務局 , 公開取得 ,佳升水電工程行,,17
