 李退之 ,新營區嘉芳里嘉芳街129巷路面改善工程, 新營區 ,531 ,531 ,工程建築及設備, 工務局 , 公開招標 ,宏泰吉營造有限公司,,7
 林燕祝 ,蔦松二街(自中正北路至蔦松二街104號前)路面破損, 永康區 ,610 ,610 ,工程建築及設備, 工務局 , 公開招標 ,"皇瑄股份有限公司
雲嘉南實業有限公司",,7
 郭清華 ,安南區北汕尾三段「由鹿耳大道至安明路」機車道路重鋪, 安南區 ,826 ,826 ,工程建築及設備, 工務局 , 公開招標 ,"皇瑄股份有限公司
雲嘉南實業有限公司",,7
 張伯祿 ,歸仁區七甲里南丁路271巷部分道路排水改善工程, 歸仁區 ,"1,500 ","1,500 ",工程建築及設備, 工務局 , 公開招標 ,維信土木包工業 ,,7
 林志聰 ,新化區崙頂里崙頂社區道路排水改善工程, 新化區 ,280 ,280 ,工程建築及設備, 工務局 , 公開招標 ,誠達土木包工業,,7
 趙昆原 ,柳營區東昇里中山西路一段352巷道路側溝改善工程, 柳營區 ,350 ,350 ,工程建築及設備, 工務局 , 公開取得 ,松右土木包工業 ,,7
 李坤煌 ,永康區永康公園邊坡修繕及步道景觀改善工程, 永康區 ,"1,000 ","1,000 ",工程建築及設備, 工務局 , 公開招標 ,鴻華營造有限公司,,7
 林宜瑾 ,正南三路(自中正南路至中正二街)路面凹凸不平, 永康區 ,"2,994 ","2,994 ",工程建築及設備, 工務局 , 公開招標 ,"雲嘉南實業有限公司
皇瑄股份有限公司
永豐砂石行
浩光企業社",,7
 莊玉珠 ,南區興農里明興路1151巷路面改善工程, 南區 ,356 ,356 ,工程建築及設備, 工務局 , 公開招標 ,"雲嘉南實業有限公司
皇瑄股份有限公司
永豐砂石行
浩光企業社",,7
 王定宇 ,學甲區公所申請美瀝包300包補助學甲區自行修補道路之用, 學甲區 ,4 ,4 ,工程業務管理, 工務局 , 公開招標 ,郁豐營造有限公司,,7
 李退之 ,柳營區南108-1線道路(重溪里內路段)AC改善工程, 柳營區 ,"1,160 ","1,160 ",工程建築及設備, 工務局 , 公開招標 ,"雲嘉南實業有限公司
皇瑄股份有限公司
永豐砂石行
浩光企業社",,7
 林炳利 ,青砂街一段633巷路燈遷移, 安南區  ,12 ,12 ,工程建築及設備, 工務局 , 開口契約 ,立業實業社,,7
 蔡蘇秋金 ,西港中央公園體健遊具區及圓形廣場遮陽網新社工程, 西港區 ,200 ,200 ,工程建築及設備, 工務局 , 辦理發包中 ,,,7
 陸美祈 ,土崎里往圓法寺巷道路面改善工程, 龍崎區 ,"1,500 ","1,500 ",工程建築及設備, 工務局 , 辦理發包中 ,,,7
 唐碧娥 ,北區開元路65號前行道樹移植, 北區 ,46 ,46 ,工程建築及設備, 工務局 , 逕洽廠商 ,竹茂土木包工業,,7
 張世賢 ,秀祐里7鄰營區旁農路改善工程, 白河區 ,593 ,340 ,建築及設備, 民政局 , 公開取得 ,三泰土木包工業,,7
 李文俊 ,善化區小新里增設廣播系統, 善化區 ,90 ,75 ,建築及設備, 民政局 , 逕洽廠商 ,正晟科技通訊行,,7
 林志聰 ,大內區曲溪里社區活動中心增建儲藏室工程(祈富), 大內區 ,"1,400 ",94 ,建築及設備, 民政局 , 限制性招標 ,榮泰企業社,,7
 李退之 ,新營區嘉芳里大將公廟空地增設體建設施, 新營區 ,195 ,195 ,建築及設備, 民政局 , 公開取得 ,豐達工程行,,7
 吳通龍 ,下營區西連里代進宮前綠美化步道改善工程, 下營區 ,250 ,250 ,建築及設備, 民政局 , 公開取得 ,豐達土木包工業,,7
 張伯祿 ,關廟區香洋里中央路22巷及民生路218巷路面改善工程(祈富), 關廟區 ,400 ,400 ,建築及設備, 民政局 , 辦理發包中 ,,,7
 謝財旺 ,新達里大屯橋北邊漁業道路改善工程, 學甲區 ,294 ,294 ,漁業建設, 農業局 , 公開招標 ,陸發土木包工業,,8
 吳通龍 ,六甲區王爺里往竹湖坑農路上邊坡改善工程, 六甲區 ,910 ,645 ,農業工程及農路改善, 農業局 , 公開招標 ,聯美營造有限公司,,8
 張世賢 ,白河區崎內里馬稠後段9-15農路改善工程, 白河區 ,440 ,425 ,農業工程及農路改善, 農業局 , 公開招標 ,承瑋營造有限公司,,8
 蔡旺詮 ,南化區東和里第七鄰聯絡道路崩塌改善工程, 南化區 ,398 ,160 ,農業工程及農路改善, 農業局 , 公開招標 ,允泰土木包工業,,8
 王峻潭 ,南化區小崙里山尾寮（174-2線）農路改善工程, 南化區 ,357 ,343 ,農業工程及農路改善, 農業局 , 公開招標 ,宏昌土木包工業,,8
 張世賢 ,東山區南溪里番仔嶺農路改善工程, 東山區 ,360 ,360 ,農業工程及農路改善, 農業局 , 公開取得 ,益成土木包工業,,8
 郭清華 ,仁德區三甲里農路改善工程, 仁德區 ,"2,000 ","1,122 ",農業工程及農路改善, 農業局 , 公開招標 ,世堡土木包工業有限公司,,8
 賴美惠 ,東山區青山里凍腳農路改善工程, 東山區 ,560 ,560 ,農業工程及農路改善, 農業局 , 公開取得 ,益成土木包工業,,8
 曾王雅雲 ,關廟區松腳里菩堤寺後方往東春食品農路改善工程, 關廟區 ,"1,260 ",315 ,農業工程及農路改善, 農業局 , 辦理發包中 ,,,8
 王峻潭 ,南化區南化里大草崙尾農路改善工程, 南化區 ,502 ,250 ,農業工程及農路改善, 農業局 , 公開取得 ,協興土木包工業,,8
 陳特清 ,龍崎區崎頂里龍崎國中旁崩塌地及嶺頂31號屋後邊坡改善工程, 龍崎區 ,640 ,750 ,水利工程, 水利局 , 公開招標 ,新志發營造有限公司,,8
 曾王雅雲 ,歸仁區崙頂里凱旋路一段601巷內野溪擋土牆工程, 歸仁區 ,690 ,650 ,水利工程, 水利局 , 公開招標 ,維信土木包工業,,8
 林志聰 ,大內區曲溪里溪洲村落野溪工程, 大內區 ,"2,005 ","1,100 ",水利工程, 水利局 , 公開招標 ,進佶營造有限公司,,8
 杜素吟 ,龍崎區石嘈里蜈蜞埔崩塌地處理工程, 龍崎區 ,457 ,480 ,水利工程, 水利局 , 辦理發包中 ,,,8
 陳特清 ,龍崎區大坪里(大坪高分79旁)崩塌地改善工程, 龍崎區 ,264 ,230 ,水利工程, 水利局 , 辦理發包中 ,,,8
 林志聰 ,大內區環湖里下崁野溪上游護坡改善工程, 大內區 ,"2,190 ","2,110 ",水利工程, 水利局 , 辦理發包中 ,,,8
"蔡秋蘭
 陳朝來",七股區東勢寮中排二排水改善工程, 七股區 ,"2,000 ","2,000 ",水利工程, 水利局 , 公開招標 ,仕強營造股份有限公司 ,,8
 趙昆原 ,柳營區重溪里五軍營法主宮前擋水牆工程, 柳營區 ,626 ,600 ,水利工程, 水利局 , 公開取得 ,巨曜營造有限公司,,8
 邱莉莉 ,永華路一段樹木移植本市南區親水公園, 中西區  ,99 ,99 ,工程建築及設備, 工務局 , 逕洽廠商 ,次郎工程行,,8
 林美燕 ,興隆路28號(永成路827巷25弄口)路面增設排水溝岸, 南區 ,100 ,100 ,工程建築及設備, 工務局 , 逕洽廠商 ,永盛土木包工業,,8
 郭清華 ,海尾宮路燈遷移工程, 安南區  ,8 ,8 ,工程建築及設備, 工務局 , 開口契約 ,立業實業社,,8
 梁順發 ,安定區港南里南133線排水溝改善工程, 安定區 ,"1,950 ","1,950 ",工程建築及設備, 工務局 , 公開招標 ,聯美營造有限公司,,8
 杜素吟 ,仁德區仁義里義林路241巷水溝改善工程, 仁德區 ,820 ,820 ,工程建築及設備, 工務局 , 公開招標  ,維成土木包工業,,8
 楊麗玉 ,麻豆區內各里道路破損嚴重申請美瀝包, 麻豆區 ,21 ,21 ,工程業務管理, 工務局 , 公開招標 ,郁豐營造有限公司,,8
 陳秋萍 ,永康區龍中街30巷等道路改善工程, 永康區 ,726 ,726 ,工程建築及設備, 工務局 , 公開招標 ,"皇瑄股份有限公司
雲嘉南實業有限公司",,8
 林全忠 ,大內區頭社里嗚頭高幹39右7路面修繕工程, 大內區 ,294 ,294 ,工程建築及設備, 工務局 , 公開招標 ,國全營造,,8
 陳怡珍 ,安南區州南里申辦長和路三段路面刨除改善, 安南區 ,"2,278 ","2,278 ",工程建築及設備, 工務局 , 公開招標 ,"皇瑄股份有限公司
雲嘉南實業有限公司",,8
 林美燕 ,南區中華南路二段南都里活動中心前停車場路面加鋪, 南區 ,330 ,330 ,工程建築及設備, 工務局 , 公開招標 ,"皇瑄股份有限公司
雲嘉南實業有限公司",,8
 陳特清 ,歸仁區中正北路二段75巷排水溝加蓋改善工程, 歸仁區 ,375 ,375 ,工程建築及設備, 工務局 , 公開取得 ,昱發土木包工業,,8
 林宜瑾 ,新化區礁坑里茄苳坑11號前及礁坑子活動中心前排水溝改善工程, 新化區 ,750 ,750 ,工程建築及設備, 工務局 , 公開招標 ,新志發營造有限公司,,8
 趙昆原 ,鹽水區橋南里南門路201巷路面改善工程, 鹽水區 ,360 ,360 ,工程建築及設備, 工務局 , 公開招標 ,承瑋營造有限公司,,8
 陳文賢 ,海埔里埤仔尾兒童公園增設遮陽棚工程, 麻豆區 ,99 ,99 ,工程建築及設備, 工務局 , 逕洽廠商 ,晉瑋土木包工有限公司,,8
 張伯祿 ,布袋里長裕街路面改善工程, 關廟區 ,"1,140 ","1,140 ",工程建築及設備, 工務局 , 公開招標 ,"雲嘉南實業有限公司
皇瑄股份有限公司
永豐砂石行
浩光企業社",,8
 唐碧娥 ,北區六甲里公園路451巷8號對面空地認養及環境髒亂改善工程, 北區 ,522 ,522 ,工程建築及設備, 工務局 , 公開招標 ,"雲嘉南實業有限公司
皇瑄股份有限公司
永豐砂石行
浩光企業社",,8
 邱莉莉 ,民權路四段、湖美街口中央分隔島增設照明設備, 南區 ,93 ,93 ,工程建築及設備, 工務局 , 逕洽廠商 ,千大廣告有限公司,,8
 郭信良 ,安南區學東里安明路四段旁(電桿：學西高分25)漁產道路舖築AC刨除料, 安南區 ,27 ,26 ,工程建築及設備, 工務局 , 公開招標 ,"雲嘉南實業有限公司
皇瑄股份有限公司
永豐砂石行
浩光企業社",,8
 郭信良 ,府安路三段319號前路燈增設, 安南區  ,8 ,8 ,工程建築及設備, 工務局 , 開口契約 ,立業實業社,,8
 賴惠員 ,柳營區里民公園步道及景觀改善工程, 柳營區 ,200 ,200 ,工程建築及設備, 工務局 , 公開招標 ,旭城工程技術顧問有限公司,,8
"賴美惠
 陳特清",歸仁區南興里文化二十街路面改善工程, 歸仁區 ,416 ,416 ,工程建築及設備, 工務局 , 公開取得 ,昱發土木包工業 ,,8
 唐碧娥 ,北區開元路124號前行道樹移植, 北區 ,62 ,62 ,工程建築及設備, 工務局 , 逕洽廠商 ,竹茂土木包工業,,8
 張世賢 ,顯濟宮前廣場整修工程, 白河區 ,"1,127 ",920 ,建築及設備, 民政局 , 公開取得 ,正國土木包工業,,8
 蔡秋蘭 ,佳里區六安里六安街巷道排水改善工程, 佳里區 ,858 ,720 ,建築及設備, 民政局 , 公開取得 ,大承土木包工業,,8
 張世賢 ,東山區南勢里第5鄰欄杆設置工程(技士), 東山區 ,180 ,96 ,建築及設備, 民政局 , 逕洽廠商 ,宏益土木包工業,,8
 蔡蘇秋金 ,佳里區鎮山里信義一街集會廣場及綠美化工程, 佳里區 ,196 ,196 ,建築及設備, 民政局 , 公開取得 ,大承土木包工業,,8
 李退之 ,新營區嘉芳里茄苳腳2號前等柏油鋪設改善工程, 新營區 ,322 ,322 ,建築及設備, 民政局 , 公開取得 ,承瑋營造有限公司,,8
 張伯祿 ,關廟區東勢里東安街241 221巷及旺萊路218巷等路面改善工程(祈富), 關廟區 ,520 ,520 ,建築及設備, 民政局 , 辦理發包中 ,,,8
 郭信良 ,安明路四段旁漁產道路改善工程, 安南區 ,326 ,212 ,漁業建設, 農業局 , 公開招標 ,健鑫土木包工業,,9
 吳通龍 ,六甲區王爺里東高蚋賢清宮後方邊坡改善工程, 六甲區 ,361 ,336 ,農業工程及農路改善, 農業局 , 公開招標 ,聯美營造有限公司,,9
 張伯祿 ,土崎里後埤農路改善工程, 龍崎區 ,860 ,180 ,農業工程及農路改善, 農業局 , 辦理發包中 ,,,9
 蔡秋蘭 ,新復溪埔寮51至70號宅前農路改善工程, 西港區 ,900 ,861 ,農業工程及農路改善, 農業局 , 公開招標 ,百村土木包工業,,9
 王峻潭 ,南化區北平與北寮里交界（南化高幹317）旁農路改善工程, 南化區 ,170 ,150 ,農業工程及農路改善, 農業局 , 公開招標 ,上展土木包工業,,9
 張世賢 ,東山區東原里水尾農路改善工程, 東山區 ,368 ,367 ,農業工程及農路改善, 農業局 , 公開取得 ,茂盛土木包工業,,9
 陳怡珍 ,層林里愛文山農路(玉山高幹296左15電桿旁)改善工程, 玉井區 ,"1,130 ",735 ,農業工程及農路改善, 農業局 , 公開招標 ,銀泰土木包工業,,9
 賴美惠 ,東山區南溪里向平農路改善工程, 東山區 ,480 ,420 ,農業工程及農路改善, 農業局 , 公開取得 ,奕昌土木包工業,,9
 杜素吟 ,關廟區布袋里草埤農路支線改善工程, 關廟區 ,420 ,420 ,農業工程及農路改善, 農業局 , 辦理發包中 ,,,9
"杜素吟 
 王峻潭",南化區南化里後壁籠農路改善工程, 南化區 ,120 ,105 ,農業工程及農路改善, 農業局 , 公開取得 ,明耀土木包工業,,9
 陳特清 ,龍崎區土崎里尖峰懷義排水改善工程, 龍崎區 ,300 ,270 ,水利工程, 水利局 , 公開招標 ,永興土木包工業,,9
 蔡淑惠 ,玉井區望明里二層溝野溪明林高分10左8左9旁延續工程, 玉井區 ,"1,000 ","1,000 ",水利工程, 水利局 , 公開招標 ,得意土木包工業,,9
 張世賢 ,白河區關嶺里六溪段野溪崩塌改善工程, 白河區 ,996 ,500 ,水利工程, 水利局 , 公開招標 ,易平土木包工業,,9
 杜素吟 ,龍崎區大坪里番社永安宮前崩塌地改善工程, 龍崎區 ,735 ,300 ,水利工程, 水利局 , 辦理發包中 ,,,9
 郭國文 ,龍崎區土崎里礁坑野溝排水改善工程, 龍崎區 ,240 ,350 ,水利工程, 水利局 , 辦理發包中 ,,,9
 林志聰 ,大內區曲溪里蘆芝坑橋下游護岸整治工程, 大內區 ,"1,235 ","1,240 ",水利工程, 水利局 , 辦理發包中 ,,,9
 蔡蘇秋金 ,西港區劉厝排水(慶安段)護堤改善工程, 西港區 ,"4,000 ","4,000 ",水利工程, 水利局 , 公開招標 ,仕強營造股份有限公司 ,,9
 蔡秋蘭 ,七股區竹港中排二後續工程, 七股區 ,354 ,"1,200 ",水利工程, 水利局 , 公開招標 ,百利土木包工業,,9
 曾培雅 ,文聖公園鋪面竄根改善工程, 東區  ,80 ,80 ,工程建築及設備, 工務局 , 逕洽廠商 ,泰霖土木包工業,,9
 王定宇 ,102臺南市仁德區中生里250-21號前瀝青路面改善工程, 仁德區  ,45 ,45 ,工程建築及設備, 工務局 , 公開招標 ,"皇瑄股份有限公司
雲嘉南實業有限公司",,9
 林美燕 ,南區佛壇里興南街252巷文中73用地旁漁產道路修繕工程, 南區 ,170 ,170 ,工程建築及設備, 工務局 , 公開招標 ,"皇瑄股份有限公司
雲嘉南實業有限公司",,9
 王峻潭 ,左鎮區南164-1線邊坡擋土牆及護欄新建工程, 左鎮區 ,450 ,450 ,工程建築及設備, 工務局 , 公開取得 ,建明土木包工業 ,,9
 張伯祿 ,關廟區松腳里中山路一段89巷路面改善及南花里旺萊路562巷路面排水改善工程, 關廟區 ,"1,100 ","1,100 ",工程建築及設備, 工務局 , 公開招標 ,承立營造有限公司 ,,9
 林志聰 ,新化區民治路(忠孝路-中山路)道路建請刨除加封, 新化區 ,628 ,628 ,工程建築及設備, 工務局 , 公開招標 ,"皇瑄股份有限公司
雲嘉南實業有限公司",,9
 林宜瑾 ,新市區大社里297-6號前道路改善工程, 新市區 ,807 ,807 ,工程建築及設備, 工務局 , 公開招標 ,"皇瑄股份有限公司
雲嘉南實業有限公司",,9
 王峻潭 ,楠西區楠西里市區道路改善工程, 楠西區 ,"1,035 ","1,035 ",工程建築及設備, 工務局 , 公開招標 ,國全營造,,9
 李文俊 ,善化區蘇厝及嘉南里田洋道路申請加鋪案, 善化區 ,603 ,603 ,工程建築及設備, 工務局 , 公開招標 ,"皇瑄股份有限公司
雲嘉南實業有限公司",,9
 蔡秋蘭 ,佳里區、西港區、七股區部分道路加封, 佳里區 ,"2,022 ","2,022 ",工程建築及設備, 工務局 , 公開招標 ,"皇瑄股份有限公司
雲嘉南實業有限公司",,9
 杜素吟 ,歸仁區武東里武東二街42巷路面改善工程(第二期), 歸仁區 ,693 ,693 ,工程建築及設備, 工務局 , 公開取得 ,昱發土木包工業,,9
 林慶鎮 ,新市區本轄區內各道路AC路面改善工程(鋪設工資), 新化區 ,"1,950 ","1,950 ",工程建築及設備, 工務局 , 公開招標 ,招盛土木包工業,,9
 蔡育輝 ,鹽水區竹埔里南72線南竹子腳段662地號側溝新建工程, 鹽水區 ,680 ,680 ,工程建築及設備, 工務局 , 公開招標 ,鼎承土木包工業 ,,9
 陳朝來 ,七股區南30線(頂山段)旁樹木植栽工程, 七股區 ,905 ,905 ,工程建築及設備, 工務局 , 公開招標 ,霖映園藝有限公司,,9
 張伯祿 ,五甲里大富街及東興一街(東興路至東興一街1號)道路改善工程, 關廟區 ,636 ,636 ,工程建築及設備, 工務局 , 公開招標 ,"雲嘉南實業有限公司
皇瑄股份有限公司
永豐砂石行
浩光企業社",,9
"陳朝來
蔡蘇秋金",佳里區番仔寮南28線(南19線至南27線)區道鋪面改善, 佳里區 ,"1,380 ","1,380 ",工程建築及設備, 工務局 , 公開招標 ,"雲嘉南實業有限公司
皇瑄股份有限公司
永豐砂石行
浩光企業社",,9
 郭清華 ,大愛、鹿耳門、台南公園設施增設, 安南區 ,98 ,98 ,工程建築及設備, 工務局 , 逕洽廠商 ,宗盛科技有限公司,,9
 郭信良 ,安南區新順里景安街(1號至89號)路面重新翻修, 安南區 ,120 ,120 ,工程建築及設備, 工務局 , 公開招標 ,"雲嘉南實業有限公司
皇瑄股份有限公司
永豐砂石行
浩光企業社",,9
 郭信良 ,城北路866巷更換鈉燈工程, 安南區  ,150 ,150 ,工程建築及設備, 工務局 , 開口契約 ,立業實業社,,9
 蔡蘇秋金 ,佳里區通興里社區道路旁行道樹斷根改善工程, 佳里區 ,135 ,135 ,工程建築及設備, 工務局 , 辦理發包中 ,,,9
"賴美惠
 陳特清",歸仁區歸南里民生九街133巷內部分路面改善工程, 歸仁區 ,395 ,395 ,工程建築及設備, 工務局 , 公開取得 ,昱發土木包工業 ,,9
 王定宇 ,富農街二段3號前PVC管埋設工程, 東區  ,48 ,48 ,工程建築及設備, 工務局 , 逕洽廠商 ,三橋營造有限公司,,9
 蔡蘇秋金 ,通興里埔頂老舊巷道改善工程, 佳里區 ,320 ,96 ,建築及設備, 民政局 , 限制性招標(小額採購) ,偉盛土木包工業,,9
 蔡秋蘭 ,佳里區溪洲里社區道路側溝護欄工程, 佳里區 ,201 ,167 ,建築及設備, 民政局 , 公開取得 ,大承土木包工業,,9
 張世賢 ,後壁區崁頂里崁頂35號之1宅前路面改善工程(技士), 後壁區 ,165 ,165 ,建築及設備, 民政局 , 公開取得 ,日新土木包工業,,9
 莊玉珠 ,南區永成路二段980巷路面改善工程, 南區 ,394 ,394 ,建築及設備, 民政局 , 公開取得 ,旭灃營造工程有限公司,,9
 李坤煌 ,永康區甲頂里公園設置健康步道, 永康區 ,287 ,287 ,建築及設備, 民政局 , 公開取得 ,順承土木包工業,,9
 張伯祿 ,龍崎區崎頂里石梯代天府廣場改善工程, 龍崎區 ,240 ,240 ,建築及設備, 民政局 , 辦理發包中 ,,,9
 蔡蘇秋金 ,十份里東漁塭5號橋周邊產業道路後續改善工程, 七股區 ,393 ,284 ,漁業建設, 農業局 , 公開招標 ,弘鋅營造有限公司,,10
 吳通龍 ,官田區二鎮里南113線旁產業道路改善工程, 官田區 ,"1,001 ","1,001 ",農業工程及農路改善, 農業局 , 公開招標 ,久明土木包工業,,10
 張伯祿 ,石嘈里田草埔農路改善工程, 龍崎區 ,528 ,240 ,農業工程及農路改善, 農業局 , 公開招標 ,聯宏土木包工業,,10
 蔡淑惠 ,永成路二段505號旁農路改善工程, 南區區 ,104 ,283 ,農業工程及農路改善, 農業局 , 已註銷 ,,,10
 王錦德 ,安南區頂安里北安路三段399號旁農業產業道路改善工程, 安南區 ,600 ,802 ,農業工程及農路改善, 農業局 , 已註銷 ,,,10
 張世賢 ,白河區六溪里檳榔腳2號橋邊及南勢井仔湖農路改善工程, 白河區 ,136 ,60 ,農業工程及農路改善, 農業局 , 公開取得 ,駿霖營造有限公司,,10
 陳秋萍 ,南化區玉山里柚子腳支線農路排水溝改善工程, 南化區 ,"2,600 ",288 ,農業工程及農路改善, 農業局 , 公開招標 ,上展土木包工業,,10
 賴美惠 ,六溪里埤寮湖產業道路改善工程, 白河區 ,317 ,285 ,農業工程及農路改善, 農業局 , 公開取得 ,承瑋營造有限公司,,10
 蔡秋蘭 ,佳里區建南里(第一公墓旁)農路改善工程, 佳里區 ,870 ,660 ,農業工程及農路改善, 農業局 , 公開取得 ,強維營造有限公司,,10
 王峻潭 ,南化區中坑里水口農路改善工程, 南化區 ,120 ,120 ,農業工程及農路改善, 農業局 , 公開取得 ,明耀土木包工業,,10
 蔡玉枝 ,玉井區劉陳坑溪旁大松腳排水改善工程, 玉井區 ,250 ,240 ,水利工程, 水利局 , 公開招標 ,得意土木包工業,,10
 李退之 ,新營區府西路259巷雨水下水道新建工程, 新營區 ,"1,310 ","1,310 ",下水道工程, 水利局 , 公開招標 ,集揚營造有限公司,,10
 張世賢 ,白河區六溪里石廟仔後方野溪護岸改善工程, 白河區 ,"1,170 ",530 ,水利工程, 水利局 , 公開招標 ,鑫億土木包工業,,10
 杜素吟 ,龍崎區牛埔里衛生室旁崩塌地處理工程, 龍崎區 ,754 ,600 ,水利工程, 水利局 , 辦理發包中 ,,,10
 郭國文 ,大內區曲溪里蘆芝坑排水改善工程, 大內區 ,"1,200 ","1,130 ",水利工程, 水利局 , 辦理發包中 ,,,10
"林志聰
 施重男",新化區大坑里中興段405地號野溪整治工程, 新化區 ,"2,013 ","2,010 ",水利工程, 水利局 , 辦理發包中 ,,,10
 蔡蘇秋金 ,七股區看坪里看坪小排一之二改善工程, 七股區 ,"2,000 ","2,000 ",水利工程, 水利局 , 公開招標 ,仕強營造股份有限公司,,10
 蔡秋蘭 ,七股區義合中排後續改善工桯, 七股區 ,"2,500 ","1,500 ",水利工程, 水利局 , 公開招標 ,"百利土木包工業
",,10
 郭信良 ,公學路六段721巷口路燈增設工程, 安南區  ,15 ,15 ,工程建築及設備, 工務局 , 開口契約 ,立業實業社,,10
 陳文科 ,東區崇德里崇明十三街11巷路面改善工程, 東區  ,500 ,500 ,工程建築及設備, 工務局 , 公開招標 ,"皇瑄股份有限公司
雲嘉南實業有限公司",,10
 陳進益 ,下營區西連里道路改善工程, 下營區  ,"1,310 ","1,310 ",工程建築及設備, 工務局 , 公開招標 ,"皇瑄股份有限公司
雲嘉南實業有限公司",,10
 王峻潭 ,南化區北平里鄰里道路邊溝改善工程, 南化區 ,850 ,850 ,工程建築及設備, 工務局 , 公開招標 ,元第土木包工業,,10
 林慶鎮 ,新市區社內里28-12號旁道路排水改善工程, 新市區 ,550 ,550 ,工程建築及設備, 工務局 , 公開取得 ,理匠營造有限公司,,10
 蔡旺詮 ,東區東門路三段11巷道路路面重舖一案, 東區 ,354 ,354 ,工程建築及設備, 工務局 , 公開招標 ,"皇瑄股份有限公司
雲嘉南實業有限公司",,10
 林宜瑾 ,新市區大社里297-6號前道路改善工程, 新市區 ,538 ,538 ,工程建築及設備, 工務局 , 公開招標 ,"皇瑄股份有限公司
雲嘉南實業有限公司",,10
 張世賢 ,白河區詔安里1-6鄰75號宅前及8-9鄰斗笠公園旁部落道路改善工程, 白河區 ,612 ,612 ,工程建築及設備, 工務局 , 公開招標 ,宏泰吉營造有限公司,,10
 謝財旺 ,學甲區公所申請美瀝包300包供學甲地區道路修補, 學甲區 ,42 ,42 ,工程建築及設備, 工務局 , 公開招標 ,郁豐營造有限公司,,10
 郭信良 ,安南區學東里城北路736巷至公學路七段尾路面翻修, 安南區 ,"1,518 ","1,518 ",工程建築及設備, 工務局 , 公開招標 ,"皇瑄股份有限公司
雲嘉南實業有限公司",,10
 陳特清 ,歸仁區南保里部分路面改善工程, 歸仁區 ,250 ,250 ,工程建築及設備, 工務局 , 公開取得 ,弘鋅營造有限公司 ,,10
 侯澄財 ,北門區蚵寮社區大眾爺廟旁道路改善工程, 北門區 ,"1,700 ","1,700 ",工程建築及設備, 工務局 , 公開招標 ,竹順土木包工業,,10
 蔡育輝 ,新營區鐵線里南70線側溝暨AC改善工程, 新營區 ,"1,000 ","1,000 ",工程建築及設備, 工務局 , 公開取得 ,巨曜營造有限公司,,10
 賴美惠 ,泰安宮廟後綠美化工程, 後壁區  ,905 ,905 ,工程建築及設備, 工務局 , 辦理發包中 ,,,10
 張伯祿 ,關廟區關廟里路面改善工程, 關廟區 ,"1,389 ","1,389 ",工程建築及設備, 工務局 , 公開招標 ,"雲嘉南實業有限公司
皇瑄股份有限公司
永豐砂石行
浩光企業社",,10
 陳進益 ,下營區中山路一段151巷道路改善工程, 下營區 ,76 ,76 ,工程建築及設備, 工務局 , 公開招標 ,"雲嘉南實業有限公司
皇瑄股份有限公司
永豐砂石行
浩光企業社",,10
 林美燕 ,金華路一段8巷24號路燈加掛燈組, 南區 ,13 ,13 ,工程建築及設備, 工務局 , 開口契約 ,立業實業社,,10
 黃麗招 ,安南區溪心里智安三街路面改善, 安南區 ,520 ,520 ,工程建築及設備, 工務局 , 公開招標 ,"雲嘉南實業有限公司
皇瑄股份有限公司
永豐砂石行
浩光企業社",,10
 郭清華 ,府安路七段370-20號增設路燈, 安南區  ,12 ,12 ,工程建築及設備, 工務局 , 開口契約 ,立業實業社,,10
 李坤煌 ,光復里公兒17-2鄰里公園整修工程, 永康區 ,100 ,100 ,工程建築及設備, 工務局 , 逕洽廠商 ,景豪景觀設計有限公司,,10
 張伯祿 ,布袋里南160線長榮街南一球場前排水改善工程, 關廟區 ,850 ,850 ,工程建築及設備, 工務局 , 辦理發包中 ,,,10
